[
  {
    "id": "1",
    "name": "ตะกร้าหวายทรงกลมปากหยัก",
    "description": "ตะกร้าหวายทรงกลมปากหยัก หูจับสูง ลายสานถี่ งานประณีตจากช่างบ้านบุทม",
    "category": "หูจับสูง",
    "images": ["basket-01-round-scalloped.jpg"],
    "panorama360": "basket-01-360.jpg",
    "price": 350,
    "stock": 15,
    "storeCat": "basket",
    "emoji": "🧺"
  },
  {
    "id": "2",
    "name": "ตะกร้าหวายทรงกลมฐาน 11 นิ้ว",
    "description": "ตะกร้าหวายทรงกลม ฐาน 11 นิ้ว หูจับมั่นคง สานมือ 100%",
    "category": "ทรงกลม",
    "images": ["basket-02-round-11inch.jpg"],
    "panorama360": "basket-02-360.jpg",
    "price": 280,
    "stock": 25,
    "storeCat": "basket",
    "emoji": "🧺"
  },
  {
    "id": "3",
    "name": "ตะกร้าหวายมีฝา ชุดคู่",
    "description": "ตะกร้าหวายมีฝาปิด ชุดคู่ ลายสานละเอียด เหมาะเป็นของฝาก",
    "category": "มีฝา",
    "images": ["basket-03-lidded-pair.jpg"],
    "panorama360": "basket-03-360.jpg",
    "price": 520,
    "stock": 10,
    "storeCat": "basket",
    "emoji": "🎁",
    "badge": "ของขวัญ"
  },
  {
    "id": "4",
    "name": "ตะกร้าหวายทรงเหลี่ยมมีฝา",
    "description": "ตะกร้าหวายทรงเหลี่ยมมีฝา หูจับมั่นคง ลายสานโปร่งตรงกลาง วางซ้อนได้สะดวก",
    "category": "ทรงเหลี่ยม",
    "images": ["basket-04-rectangular-lid.jpg"],
    "panorama360": "basket-04-360.jpg",
    "price": 480,
    "stock": 3,
    "storeCat": "basket",
    "emoji": "🧺"
  },
  {
    "id": "5",
    "name": "ตะกร้าหวายหลายแบบ",
    "description": "ตะกร้าหวายหลากหลายทรง ทั้งกลม เหลี่ยม และปากหยัก จากราชาหวายสุรินทร์",
    "category": "ทรงกลม",
    "images": ["basket-05-collection.jpg"],
    "panorama360": "basket-05-360.jpg",
    "price": 590,
    "stock": 8,
    "storeCat": "basket",
    "emoji": "🧺"
  },
  {
    "id": "6",
    "name": "ตะกร้าหวาย 8 เหลี่ยม ชั้นเดียว",
    "description": "ตะกร้าหวายทรงแปดเหลี่ยม ชั้นเดียว หูจับสูง ลายสานเนี้ยบ งานพิเศษจากช่างฝีมือบ้านบุทม สวยงามทนทาน ใช้ได้หลากหลาย",
    "category": "พิเศษ",
    "special": true,
    "images": ["basket-06-octagonal-single.jpg"],
    "price": 650,
    "stock": 0,
    "storeCat": "basket",
    "emoji": "🧺",
    "badge": "พิเศษ"
  },
  {
    "id": "7",
    "name": "ตะกร้าหวาย 8 เหลี่ยม 2 ชั้น",
    "description": "ตะกร้าหวายทรงแปดเหลี่ยม 2 ชั้น หูจับสูง ลายสานโปร่ง งานพิเศษจากช่างฝีมือบ้านบุทม เหมาะใช้งานและตกแต่งบ้าน",
    "category": "พิเศษ",
    "special": true,
    "images": ["basket-07-octagonal-lifestyle.jpg"],
    "price": 720,
    "stock": 5,
    "storeCat": "basket",
    "emoji": "🧺",
    "badge": "พิเศษ"
  },
  {
    "id": "8",
    "name": "ตะกร้ากลม 2 ชั้น ถักปาก",
    "description": "ตะกร้าหวายทรงกลม 2 ชั้น ปากถักตกแต่ง หูจับสูง งานสานมือจากช่างฝีมือบ้านบุทม เหมาะถวายทำบุญและใช้งานทั่วไป",
    "category": "ทรงกลม",
    "images": [
      "basket-08-round-studio.jpg",
      "basket-08-round-temple.jpg",
      "basket-08-round-grass.jpg"
    ],
    "price": 420,
    "stock": 20,
    "storeCat": "basket",
    "emoji": "🧺"
  },
  {
    "id": "9",
    "name": "ตะกร้าหวายรีเหลี่ยม 2 ชั้น พิเศษ",
    "description": "ตะกร้าหวายทรงรีเหลี่ยม 2 ชั้น ปากหยัก หูจับสูง ลายสานโปร่ง งานพิเศษสานมือจากช่างฝีมือบ้านบุทม เหมาะใส่ผลไม้ ของใช้ และตกแต่งบ้าน",
    "category": "พิเศษ",
    "special": true,
    "images": [
      "basket-09-oval-community.jpg",
      "basket-09-oval-lifestyle.jpg",
      "basket-09-oval-topdown.jpg"
    ],
    "price": 750,
    "stock": 8,
    "storeCat": "basket",
    "emoji": "🧺",
    "badge": "พิเศษ"
  },
  {
    "id": "10",
    "name": "เก้าอี้หวาย",
    "description": "เก้าอี้หวายสานมือ พร้อมโต๊ะหวาย ดีไซน์โค้งมน นั่งสบาย เหมาะมุมนั่งเล่น มุมสวน และพื้นที่พักผ่อน งานช่างฝีมือบ้านบุทม",
    "category": "เก้าอี้",
    "images": ["chair-10-garden-set-1.jpg", "chair-10-garden-set-2.jpg"],
    "price": 3800,
    "stock": 6,
    "storeCat": "chair",
    "emoji": "🪑"
  },
  {
    "id": "11",
    "name": "เก้าอี้หวาย ทรงกลม",
    "description": "เก้าอี้หวายทรงกลมสานมือ ชุดคู่พร้อมโต๊ะหวาย ดีไซน์หลังมน นั่งสบาย เหมาะมุมระเบียง มุมนั่งเล่น และพื้นที่พักผ่อน งานช่างฝีมือบ้านบุทม",
    "category": "เก้าอี้",
    "images": ["chair-11-patio-set.jpg"],
    "price": 4500,
    "stock": 4,
    "storeCat": "chair",
    "emoji": "🪑"
  },
  {
    "id": "12",
    "name": "ตะกร้าหวายสี่เหลี่ยมจัตุรัส 2 ชั้น",
    "description": "ตะกร้าหวายทรงสี่เหลี่ยมจัตุรัส 2 ชั้น หูจับสูง ลายสานโปร่ง งานพิเศษสานมือจากช่างฝีมือบ้านบุทม เหมาะใส่ของใช้ ผลไม้ และตกแต่งบ้าน",
    "category": "พิเศษ",
    "special": true,
    "images": [
      "basket-12-square-lifestyle.jpg",
      "basket-12-square-usage.jpg",
      "basket-12-square-topdown.jpg"
    ],
    "price": 890,
    "stock": 12,
    "size": "กว้าง 30×30×35 ซม.",
    "storeCat": "basket",
    "emoji": "🧺",
    "badge": "ยอดนิยม"
  }
]
